{
  "schema": 1,
  "operation_id": "00000016-2222-4222-8222-000000000016",
  "audit_ref": "refs/autosk/epics/e8bf51e33ced6fd2373da93a8317cac9158ff524d31c8d972705b25c6b1873c1/audit/candidates/1347dcda3447bc0b10e6bb4eb85a2ee7b4c2d8deeea92a924fb0bf7637b80dc9",
  "expected_oid": "264029a5827e5674dc038091abea2c6df347bd2b",
  "retention_policy_digest": "bbbbbbbbbbbbbbbbbbbbbbbbbbbbbbbbbbbbbbbbbbbbbbbbbbbbbbbbbbbbbbbb",
  "inventory_digest": "cccccccccccccccccccccccccccccccccccccccccccccccccccccccccccccccc",
  "expires_at_utc": "2026-09-01T00:00:00Z",
  "operator_approval": {
    "record_id": "66666666-6666-4666-8666-666666666666",
    "approved_by": "operator",
    "approved_at_utc": "2026-09-01T00:00:01Z",
    "digest": "d555571f2b2fa21d7bccbb7e033152b0517a0fec9dc5fb583e7f1d2ab787856a"
  },
  "phase": "tombstone_verified",
  "helper_evidence": {
    "request_id": "00000008-1111-4111-8111-000000000008",
    "nonce": "6b43c62ebee4ab94e4d5827cf42d4199f93205641e9d18d90efccc9e54665353",
    "request_body_sha256": "985b1798e77af07fe49ba2c12f8a10a66e379303cc591853cea97d35f54bf3b3",
    "transaction_value_observation_sha256": "a5a187cff298fa659f0932fddffd79341df9aaafae73dfb5313225979bf33f29",
    "helper_receipt_hash": "8b2ab18cad764bc0f7fc1f559cf7fa4572a6a5a4b5504b7ac474d03f65133caf",
    "helper_journal_hash": "17156182e0da5d78b51f7f18fb00e020f2144a07cb8098ddb60eb8fb32ec4fd4"
  },
  "tombstone_receipt": {
    "schema": 1,
    "operation_id": "00000016-2222-4222-8222-000000000016",
    "deleted_audit_ref": "refs/autosk/epics/e8bf51e33ced6fd2373da93a8317cac9158ff524d31c8d972705b25c6b1873c1/audit/candidates/1347dcda3447bc0b10e6bb4eb85a2ee7b4c2d8deeea92a924fb0bf7637b80dc9",
    "deleted_oid": "264029a5827e5674dc038091abea2c6df347bd2b",
    "helper_receipt_hash": "8b2ab18cad764bc0f7fc1f559cf7fa4572a6a5a4b5504b7ac474d03f65133caf",
    "inventory_digest": "cccccccccccccccccccccccccccccccccccccccccccccccccccccccccccccccc",
    "retention_policy_digest": "bbbbbbbbbbbbbbbbbbbbbbbbbbbbbbbbbbbbbbbbbbbbbbbbbbbbbbbbbbbbbbbb",
    "deleted_at_utc": "2026-09-01T00:00:02Z",
    "receipt_hash": "ecd32a575f99c99a40427d04e259a3861830716123060667ed3558000296e197"
  },
  "created_at_utc": "2026-09-01T00:00:01Z",
  "completed_at_utc": "2026-09-01T00:00:02Z"
}
